,Unnamed: 0,comment_text,id,identity_hate,insult,obscene,set,severe_toxic,threat,toxic,toxicity
46966,13663, stop male infant genital cutting  the national organization of restoring men has info about circumcision and restoring foreskin male infant circumcision is why all this is happening  learn about circumcision and get the word out on occupy wall street  re imagine by trillion feat andy gibson  john lennon tribute  http w youtube com watch v  c unc ritk  wake up  http w youtube com watch v laha yd nl  http w circumcision org index html  more information including sign messages  http davidwilton smugmug com groups san francisco pride dmcc vcjcs http davidwilton smugmug com groups san francisco pride dmcc xmwsn  list if sites with circumcision info  http w bayareaintactivists org resources  the original foreskin can not be recovered but some of the functions of the foreskin can be restored with foreskin restoration  google foreskin restoration the national organization of restoring men has info about circumcision and restoring foreskin http tlctugger com the tugging method used to restore foreskin like the kind offered at  http tlctugger com  increase skin slack in the penis and improve the function fixing some of the issues but not all  of course the only way to fix it is to prevent the infant  circumcision in the first place  stop mutilating male infant genitals  you can not get your original foreskin back but you can restore your foreskin  google foreskin restoration the national organization of restoring men  http davidwilton smugmug com groups san francisco pride dmcc xmwsn sites with information about circumcision http w bayareaintactivists org resources white house circumcision petition needs signers up to and on oct https ws whitehouse gov petitions petition ban non therapeutic routine infant circumcision  tqgsztg routine infant circumcision is in direct violation of human rights  it is also against the hippocratic oath  which states do no harm  circumcision is harmful to infants and the men that they will become  a circumcision itself takes to of the male shaft skin on the penis  it also takes over fine touch nerve sensors  the gentle gliding mechanism that is offered by the foreskin  and the protection of the foreskin itself  it causes unnecessary pain to the infant and the anesthesia does not block all the pain that an infant feels  in a ban was formed against genital cutting of infant females  under the law the ban should also cover male infants too as the equal protection act states  it s time for all sexes to be protected from this barbaric practice  the national organization of restoring men has information about circumcision and foreskin restoration  http w  eric org  penn teller on circumcision part http w youtube com watch v vlgcqpe xu  penn says  matching penises http w youtube com watch v  yrfnciruak circumcision kills  santa monica http w youtube com watch v xvrkdymkuci circumcision kills http w youtube com watch v  juodnmrwpm all the videos on user bonobo d youtube channel which has this video circumcision jew ish identity http w youtube com watch v zaqdm cxy c ,2411c3856ded4cf2,0.0,0.0,0.0,train,0.0,0.0,0.0,0
795,78220,  and no matter how hard you try to block me  you can t stop me,d15beb65380f84b9,0.0,0.0,0.0,train,0.0,0.0,0.0,0
73463,75915,diacritics hey thanks for linking me to wp hockey about the diacritics  i ve been looking for that guideline for quite some time now  ,cb1e1f7c4b09bfb0,0.0,0.0,0.0,train,0.0,0.0,0.0,0
135483,137832,thanks for the feedback  and i m very glad to know it was of interest  i m saving it for a summer lull myself the book is bellah s religion in human evolution  if anyone else is curious  ,e18dfcca65a5facd,0.0,0.0,0.0,train,0.0,0.0,0.0,0
97856,129112,i would say it is not notable because we cannot find any article or book that is exclusively about this subject ,b284fd07f80e532f,0.0,0.0,0.0,train,0.0,0.0,0.0,0
114934,120874,oh boho ho bo the ho to alexbrn who seems eager to erase reality  gaelanclark,86b433f9381d3016,0.0,0.0,0.0,train,0.0,0.0,0.0,0
144984,78830,unitarian ministry career i attempted to insert into this article paragraphs lifted from his main wikipedia article relating to his short lived unitarian ministry career which was exercised during the s  in the period this article covers  in somerset and at shrewsbury  shropshire  at the latter william hazlitt met him however the edit was  block  because  according to the message that came up  there were links with particular archive sources that made the copying incompatible  could someone better able to deal with this carry that out  or advise me how these could be worked around ,d2eef8867ccded69,0.0,0.0,0.0,train,0.0,0.0,0.0,0
38906,83914, okay  there s a start  i made the curent tabs white to have some contrast  talk ,e089c45f5428f8aa,0.0,0.0,0.0,train,0.0,0.0,0.0,0
120444,89424,please stop vandalizing  please do not add nonsense to wikipedia  it is considered vandalism  if you would like to experiment  use the sandbox  thank you ,ef334e3bd56e896e,0.0,0.0,0.0,train,0.0,0.0,0.0,0
17459,65691, as honorific title ,afb5c9e4dbdcc071,0.0,0.0,0.0,train,0.0,0.0,0.0,0
16553,94194, and speaking about his fine contributor and high quality edits so much to speak about them i know he  hate s poland and me also but this piece of trash http en wikipedia org w index php title user talk izehar diff  next oldid look who s talking about  good joke what about you they didn t start the rfc against you for nothing i suppose http en wikipedia org wiki wikipedia requests for comment ghirlandajo just look at his contributions calling names  ad hominem attacks and usage of offensive language  calling poles polacks when asked to apologize or stay on topic  he replied with offensive language zombie revert zombie suggestions of being intoxicated by obscure polish hack writers  ignorance  ad hominem arguments  calling the arguments of the opponents slurs and hysteria  offensive language  ethnic slurs  all is there  in one edit diff  also  bizarre accusations of some sort of conspiracy if this statement is a personal opinion of halibutt  molobo  rydel  and co  you may continue gaping at your cheap polish propaganda booklets about alleged russian massacres  which i daresay are not considered a credible source even by wikipedia as well  ad hominem attack later even strengthened  rvv a revert maniac  can t we block him racist ethnic generalizations and accuasion of incivility on behalf of the entire polish nation trying to escalate the conflict at talk history of belarus by posting this comment at portal russia new article announcements  the notice was finally removed after wojsyl asked him to stay cool  accusations of  breaking the wiki rules though later removed  paranoia bad faith ignorance fantasies rm polish idiosyncrasies http en wi,fbe3931986a2091c,0.0,0.0,0.0,train,0.0,0.0,1.0,1
74163,65500,do so all mexicans and black people are  shit  heads and im in the k fuck heads  ,af346c6830112804,1.0,1.0,1.0,train,1.0,0.0,1.0,1
77581,143267,fastily take it up the ass  douchebag ,fe2b712030d9f1df,0.0,1.0,1.0,train,0.0,0.0,1.0,1
13442,14288,  why can t we just say salafists and hooligans or something like that  they are hooligans  after all  ,25bc9685c0c37e22,0.0,0.0,0.0,train,0.0,0.0,0.0,0
88423,24503,i am glad you understand this  my goal is to make you protect as many articles as possible  i am actually targeting all articles ever edited by user tabib  i would like to show him the very basic idea of internet where totalitarian rules cannot be applied ,40bbc4ff800ccdf0,0.0,0.0,0.0,train,0.0,0.0,0.0,0
115152,58843,oh ok thanks for the tip but do i have to do that everytime,9d98f8ae1f1ca25f,0.0,0.0,0.0,train,0.0,0.0,0.0,0
123957,67942,redirect talk list of diplomatic missions of honduras,b5c1b46232e87843,0.0,0.0,0.0,train,0.0,0.0,0.0,0
89813,137724,i deleted it again thanks for letting me know  edgar ,e0ffdc633c8277e5,0.0,0.0,0.0,train,0.0,0.0,0.0,0
65429,146413,at the time  including,2bbf3b5c5a5a1a6f,0.0,0.0,0.0,train,0.0,0.0,0.0,0
38453,112059, of course  my critical additions are all unreasonable and unfair  while your biased partisan ones are all reasonable and logical  right  puh lease  next thing you are going to tell us is that being a dirty trickster is legitimate  after all  you re just doing the right thing and the ends justify the means  typical progessive stalinist  speak  i ve restored the complete version which you have vandalized yet again nicolas leobold ,57864eaaca67e2c8,0.0,0.0,0.0,train,0.0,0.0,0.0,0
61234,15138,allmusic  rolling stone  spin  popmatters  slant magazine  and many others  can be used to support an album genre  adult contemporary is sometimes consider a music genre  even if i think it s only a radio format along with classic rock or album oriented rock  i think you should discuss it on the article s talk page ,27f9559ff8bf9ead,0.0,0.0,0.0,train,0.0,0.0,0.0,0
125060,96568,regardless of what you believe  it s not part of the definition  so it shouldn t be phrased as such now  apparently  you want me to teach you economics fine payment of wages for labor is an emergent phenomenon in free markets  a number of things happen technology advances  which increases the return to sepcialization interest rates and average profit margins decline both of these make it harder for one person to have all the skills to competitively run all parts of the business so  people start to sell just the input they re  comparatively  best at  that gives people a much higher return for their efforts than investing money at interest  or trying to do all functions of the production process well  but we really shouldn t be using the talk page for economics lessons ,0480bf9668f97a75,0.0,0.0,0.0,train,0.0,0.0,0.0,0
148683,158768,well what s wrong with you ,f3654410aebd80e9,0.0,0.0,0.0,train,0.0,0.0,0.0,0
139750,71735,the tale of baldilocks and the three hairs  lol ,c01312749191d614,0.0,0.0,0.0,train,0.0,0.0,0.0,0
55424,104482, why are my section keep being undone everything here could be considered chat and undone  there is obviously a biased cabal of editors at work here  including summerphd  jeff g  rolandr and many others  ,2efa85e5b79eb0e1,0.0,0.0,0.0,train,0.0,0.0,0.0,0
106805,40644,lol yeah  you d think they were designed for swimming and that there is no other technology suitable for that role there really should be a lot more about the trendy fashioncentric aspect of jeans which imo much better represents them in the past years and some non levis info i d do it myself but i don t really follow jeans or fashion myself mar utc ,6c7c3118501f91dd,0.0,0.0,0.0,train,0.0,0.0,0.0,0
98835,43521,if you think it works  would you be so kind as to help nominate it as i am not really good at that kind of stuff thanks ,7425e8069cabfbe8,0.0,0.0,0.0,train,0.0,0.0,0.0,0
92416,152970,i included cows in action in there on astrosaurs because it was related to it  also astrosaurs academy is not made up  its true  i want to know if the cows in action article can be created again  also move cows in action to steve cole if you must  but don t delete the section about astrosaurs academy its not a fake section its true  ,9568b0a4121505c7,0.0,0.0,0.0,train,0.0,0.0,0.0,0
49961,81846, the problem is the wider we cast the net in terms of subject matter for the article  the more room there is for disagreement and debate energies are dispersed  and the article becomes lopsided and uneven read the article on human skin color this article discusses the various theories about human skin color one scenario is that fair skin is the result of spontaneous  random mutation  that  theoretically  there were white skinned people  the result of genetic mutations  in africa  but they simply did not survive to produce progeny  that the same mutations occurred when humans migrated north  but because of the climate  those mutants survived to bear and rear offspring another scenario posits that humans initially were pale like simians  but as they began to lose their hair  their skin darkened over time as a climatic accommodation and there are other theories  as well you want to get into melanin in this article  and the accompanying sturm und drang of agrument  disagreement and  potentially  more edit warring  just look at what s happened here with a far narrower piece and for material that eventually will be cut out  anyway the mechanics of melanin this still reads like a phenomenally bad idea  ,dae592e574bcb31d,0.0,0.0,0.0,train,0.0,0.0,0.0,0
82689,134272,hello  and welcome to wikipedia here are some tips to help you get started read the tutorial  and feel free to experiment in the sandbox eventually  you might want to read how to write a great article  naming conventions  the manual of style and policies and guidelines explore  be bold in editing pages  and  most importantly  have fun i hope you enjoy editing here and being a wikipedian  if you have any questions  post a question at the help desk or my talk page by the way  you can sign your name using three tildes  like this four tildes produces your name and the current date nice work on lali  drum ,cdfdebf7e225b797,0.0,0.0,0.0,train,0.0,0.0,0.0,0
142536,5862,this page has been completely ruined it has been half changed for some reason by some idiot it is also now completely out of date as a lot of these singles have recharted many times since this page should be taken off now if this hadn t have been messed around with in the beginning i would have kept this current also would have added a comprehensive list of most weeks on albums chart which has taken me years to collect the information am now keeping to myself rather than sharing it with you wiki beaurocrats ,0faace709220a4b1,0.0,0.0,0.0,train,0.0,0.0,0.0,0
27283,141933, hope you don  t mind  but i extended your block of to one week it was the second time and the vandalism was pretty bad first hour block didn t seem to do the trick so i felt one week may no problems if you want to use your time  i just wanted to notify you of the change talk thanks  for reverting vandalism to my user page  seen this already i know two of your brothers e  talk contribs moline a few days ago i asked you why you reverted my efforts on the moline  illinois page and either i didn t get a response from you or i didn t receive it in your initial message to me  given at the time when you reverted all of the work i had done  you called my efforts vandalism and nonsense  i realize this is probably a auto generated message sent in response to a flagged  accidental  event  but given that i ve made several attempts to communicate to you  via this page as well as four or five times thru the original vandalism nonsense to which to you responded  once with  i might add  a tone that was less than in keeping with the tone i see when i read the messages on this page nevertheless  what i was trying to accomplish with the moline page was to take a wikipedia entry that was woefully lacking and add some real value to it  i had added the the moline page a location air travel major interstate highways sports gambling and landmarks  and notable bridges sections additionally  i completely revamped the schools section into an education section that provided internal and external links to every school mentioned you removed all of that btw  i tried to document all of my efforts in the discussion page  so anyone could see what i was trying to do  make the moline page better before i found it  it was little more than a glorified rundown of which neighborhood has more mexicans than the next  and i found it simply too racist to let stand yes  i also was trying to edit the neighborhood section  to remove the racism  but also better demonstrate the real flavor and history of the town thanks to you  the history and flavor is gone  and the racism is back congratulations a final request  if you see fit to keep my efforts out of the wiki  then please be so kind as to be consistent  for i still see the results of my writing on the moline page if you are going to remove my work and have the moline page reflect the rants of one racist hick  please be consistent and completely remove all of my work either keep all of my work in  or none of it thanks  and kind regards march utc the preceding unsigned comment was added by talk contribs april utc  ,f7474e9a1861d7ed,0.0,0.0,0.0,train,0.0,0.0,0.0,0
102331,16489,it s called playing the wp point game  since his afd is doomed again what s up  doc ,2b783333c8b1f12f,0.0,0.0,0.0,train,0.0,0.0,0.0,0
154407,15023,yes  i believe i ve already said that the point in this case is answered  i ve explained the broader question i was asking twice so i ll just wait to see if anyone else has an answer  if no one so be it ,27b66577568ee293,0.0,0.0,0.0,train,0.0,0.0,0.0,0
36656,34370, nationalists first of all this is not a place for your pro terrorist  nazi  separatist propaganda  kosovans don t and never existed if you mean serbians in southern serbia  kosovo  then yes  anyway article claims guard is formed of nationalists  serbian nationalists  and serbian nationalist parties together with serbian nationalist organization absolutely don t support this organization and claim that all military actions should be made by serbian army  that unlike guard who had only members  has members including volunteer  serbian pvo and saf  paramilitary  professionals and reserve serbian nationalist organizations like etc  also support that all actions in south serbia  kosovo  should be done by serbian army  so i don t think we should put nationalist  but i still won t remove it  ,5bcc4fff6d24417b,0.0,0.0,0.0,train,0.0,0.0,0.0,0
116392,151187,on a personal note  thanks for cleaning up the citations on reading company  pennsylvania railroad  and conrail  in the future could you please use edit summaries  so that i and other editors know what changes you re making  thanks again  talk ,79035e14bff6f1c1,0.0,0.0,0.0,train,0.0,0.0,0.0,0
37298,11331, no personal attacks please and i have now opened a discusson for you at wikipedia talk wikiproject football unofficial caps  fifa or national association talk ,1e052d30d6bce2c5,0.0,0.0,0.0,train,0.0,0.0,0.0,0
19420,151528, candidate for deletion this seems like a serious article with some serious problems  the lead pseudophilosophy is a term  has no sourcing  the lead  and especially the first paragraphy of an article  is like a definition and therefore requires sourcing  the body of the article is sourced  but it s just a list of where pseudo philosophy has been used before  but does not justify the lead  i tried myself to quickly find some reliable source that would justify the lead  but couldn t find anything  the section accusations against popular philosophers should probably be removed the way it is now  two of the entries are un cited and the rand citation is by a writer of unknown qualifications  also  i can see this section degenerating into a philosophy i  hate  list  the article seems to me  the way it is now  to be a candidate for deletion  ,7eb42ae482ac14b1,0.0,0.0,0.0,train,0.0,0.0,0.0,0
59158,87120,about this things since you been in englewood ,e9102973c0652f0e,0.0,0.0,0.0,train,0.0,0.0,0.0,0
27219,127986, hold on  i m misreading you  i had proposed  rr for him i assumed that applied to the current episode  as far as i can tell  you re proposing no sanction at all ,ac8abb31aeea1d02,0.0,0.0,0.0,train,0.0,0.0,0.0,0
89379,143228,i can t speak for jimbo  but if i were in his position i would consider it an obligation to enforce the integrity of wikipedia in extreme cases like this  in spite of any disproportionate controversy that may possibly result from my actions  this seemed like a clear cut case of administrator abuse to me  i m a centrist  no bias accusations please most of the small handful of people who know about this controversy will forget about it within a week or month  the article  on the other hand  would be lost forever  the knowledge therein stolen from innumerable potential readers  think of the bigger picture  and moreover  consider these overreactions and what they implicate ,fdf398372e9c60dd,0.0,0.0,0.0,train,0.0,0.0,0.0,0
5785,20830,  i think all your edits are listed here by article  digame ,36f67f6c31f4f864,0.0,0.0,0.0,train,0.0,0.0,0.0,0
155822,25402,you are probably right about am wood  did you check the other xis i piped them mostly by  educated  guess work  talk contribs ,434130ce1d5faeca,0.0,0.0,0.0,train,0.0,0.0,0.0,0
55393,116277, whom do you cheat  if you were not emotionally involved you would move to deal with something else  analysis of your contributions shows that you are obsessed with fighting for jew ish cause  as for your remark is the israel shamir article a jew ish subject i thought he was a christian  it is disingenious at best  sneaking at worst  ,6da319ab603dbd29,0.0,0.0,0.0,train,0.0,0.0,0.0,0
232,20271,  actually what is happening is wikipedia editors are doing what they should not be doing trying to apply their own opinions and what is essentially original research  watkins is referred to as a pedophile by multiple highly reliable sources  all of these sources are referring to him as a pedophile per the clinical sense  one who is  sex ly attracted to children it is not our place to accept or reject this information  are there reliable sources anywhere that are arguing the man is not a pedophile  if that were the case  i can see why this would be up for debate  but it s not nobody is claiming the man is not a pedophile  additionally  before you argue that we don t know whether watkins is  sex ly attracted to children  i highly suggest you actually take a look at the facts of the case and all the activities he has been involved  if you can t be bothered to do that because it sickens you  then fine  but don t claim that there s just no way for anyone to know  yo ,3589cbc1e1dde1c9,0.0,0.0,0.0,train,0.0,0.0,0.0,0
8476,3221,  npvo is mostly just about the edit left by if someone with some knowledge of this topic would clean it stylistically from this fateful day shudder  and then take out the snide quips that would help  ,08b443250d0e53f0,0.0,0.0,0.0,train,0.0,0.0,0.0,0
36992,105570, nicosia is the only capital of republic of cyprus  all greek and turkish cypriots wikipedia users want to see an end to an article which presents nicosia as capital of turkish occupied northern cyprus wikipedia users who remove turkish illegally occupied  northern nicosia are banned by users who serve turkish interests  this will be administrated to wikipedia offices by e mailing  ,34dbfd7a124c87db,0.0,0.0,0.0,train,0.0,0.0,0.0,0
93619,25509,i m not one of your students  talk to me like an adult or shut up ,43893ddfd1beca02,0.0,0.0,0.0,train,0.0,0.0,1.0,1
44779,120909, secondly  it has nothing to do with the diplomat  wikipedia s rules would argue he is not notable enough for his own article  therefore his disclaimer  to distinguish between the diplomat and the radio talkshow host  shouldn t be necessary,86df497099091fe5,0.0,0.0,0.0,train,0.0,0.0,0.0,0
50643,31412, there s a note at the top of the page that explains some of this creationism can also refer to creation myths  or to a concept about the origin of the soul  for the movement in spanish literature  see creacionismo  the article attempts to give due weight to relevant sources if you believe that there are important sources that have been left out or that were not given due consideration  please do point us toward those sources  and you are  of course  always welcome to add material yourself  or discuss proposed changes thanks  ,5366fc7e8605ba16,0.0,0.0,0.0,train,0.0,0.0,0.0,0
9393,102158,  pluto is just a big cheeseball  that s it  all it is is a big cheeseball  how do i know this  i went to a special science lab  so now we know we know what it is we don t have to wonder what it s made of,22bd338c4bd6ba55,0.0,0.0,0.0,train,0.0,0.0,0.0,0
24350,94004, for richard feb unfortunately haar reviewed the book this is not about explsion it is about ethnic cleanings before done by germans and scientists who supported this ideas  overmans book deutsche milit  rische verluste im zweiten weltkrieg  is strictly about german military losses nothing more nothing there about expulsion i confess that i don t know what nitschke has to say on this subject she says of around million germans within the lands of post war poland in six million fled or were evacuated million were expelled  one million were verified as poles remained in poland as a german minority  and up to million died  p thus that means total millions deaths she also says though estimates of the dead range widely  as many as a million germans perished during flight and expulsion from poland in it means in years take for consideration that so call wild expulsion started on may and the and first part of was actually the flight next she says in the long fourth chapter  nitschke turns to the expulsions  which came in three waves  during a period of wild expulsions from may to july the polish military drove up to germans across poland s new western border  the second wave of expulsions came after the potsdam conference  but before the organized  trans fer of remaining germans began in early from august to december poles expelled close to more germans in poorly organized  trans ports  the final phase involved the  trans fer of million germans in a process coordinated with british and soviet authorities in occupied germany in and ,fb5aaaaa676ddc5a,0.0,0.0,0.0,train,0.0,0.0,0.0,0
84603,46613,hey there guys this is my talk page  leave any comments questions concerns about my editing or where you think i can help with editing  i will respond to your remarks here on my talk page as well as on your own  i reply on your talk pages so that i know you got my message  and i reply here on my own so i remember who i have replied to ,7c9640b0c116badc,0.0,0.0,0.0,train,0.0,0.0,0.0,0
