,Unnamed: 0,comment_text,id,identity_hate,insult,obscene,set,severe_toxic,threat,toxic,toxicity
31347,141309, image tagging image george bamberger and fans jpg this media may be deleted thanks for uploading image george bamberger and fans jpg  i notice the  image  page currently doesn t specify who created the content  so the copyright status is unclear  if you have not created this media yourself then you need to argue that we have the right to use the media on wikipedia  see copyright tagging below if you have not created the media yourself then you should also specify where you found it  i e in most cases link to the website where you got it  and the terms of use for content from that page if the media also doesn t have a copyright tag then you must also add one  if you created took the picture  audio  or video then you can use  to release it under the gfdl  if you believe the media qualifies as fair use  please read fair use  and then use a tag such as  or one of the other tags listed at wikipedia image copyright tags fair use see wikipedia image copyright tags for the full list of copyright tags that you can use if you have uploaded other media  please check that you have specified their source and copyright tagged them  too  you can find a list of  image  pages you have edited by clicking on the my contributions link  it is located at the very top of any wikipedia page when you are logged in and then selecting image from the dropdown box  note that any unsourced and untagged images will be deleted one week after they have been uploaded  as described on criteria for speedy deletion  thank you  t c ,f4044e02c7ba14ef,0.0,0.0,0.0,train,0.0,0.0,0.0,0
53900,147614, wapipedia anyone here use it  http wapipedia org i m kind of new to it  and there doesn t seem to be a talk editing facility  so i m going to post this here  hope that s okay  their article on the prophet mohammed includes the following text by his own standards  the continuing traditions of social justice in the islamic world  of methods and knowledge of science  history and medicine as they evolved in the modern world  thanks to his profound influence driving muslims to literacy and inquiry and the prayers of over one billion muslims  many of whom pray for him five times a day  or attach peace be upon him after each mention of his name render muhammad arguably the most influential man in all history  an honour often reserved for jesus in the west  even those historians who have deplored his influence and considered it to have  retard ed the growth of its chief rival faith  christianity  express grudging admiration for the man and this to the traitors inside medina it must have come as a surprise when the strong force of abu sufyan failed to cross a trench dug around medina by order of muhammad  as the persian scribe salman e farsi had suggested to him  after the retreat of abu sufyan and his forces  the muslims directed their attention towards the groups that had committed treason to the charter of medina  the munafiqun quickly crumbled  and their leader abd allah ibn ubayy pledged allegiance to muhammad  the muslims then besieged the banu qurayza  who had intrigued against them  they had the opportunity of choosing muhammad as an arbitrator  but instead the banu qurayza chose saad ibn muadh  the leader of their former allies  the aus and this is its take on the battle of badr ce  which is markedly different to that found in the wikipedia article  which raises doubts about the aftermath of the battle on march near a place called badr  the two forces clashed  though outnumbered to in the battle  the muslims met with success  killing at least makkans  including abu jahl  and taking prisoners  whereas only muslims died  to the muslims this appeared as a divine vindication of muhammad s prophethood  and he and all the muslims rejoiced greatly  following this victory  assassinations eliminated medinans who had satirized muhammad  and the victors expelled a hostile jew ish clan  virtually all the remaining medinans converted and muhammad became de facto ruler of the city  i had the idea that wapipedia was a direct  trans fer of wikipedia articles onto wap  but it seems not  timbudds acasa ro ,3f19e6eb75db629c,0.0,0.0,0.0,train,0.0,0.0,0.0,0
145186,95012,unspecified source for image usdx screenshot jpg  thanks for uploading image usdx screenshot jpg  i noticed that the file s description page currently doesn t specify who created the content  so the copyright status is unclear  if you did not create this file yourself  then you will need to specify the owner of the copyright  if you obtained it from a website  then a link to the website from which it was taken  together with a restatement of that website s terms of use of its content  is usually sufficient information  however  if the copyright holder is different from the website s publisher  then their copyright should also be acknowledged as well as adding the source  please add a proper copyright licensing tag if the file doesn t have one already  if you created took the picture  audio  or video then the  tag can be used to release it under the gfdl  if you believe the media meets the criteria at wikipedia fair use  use a tag such as  or one of the other tags listed at wikipedia image copyright tags fair use  see wikipedia image copyright tags for the full list of copyright tags that you can use if you have uploaded other files  consider checking that you have specified their source and tagged them  too  you can find a list of files you have uploaded by following this link unsourced and untagged images may be deleted one week after they have been tagged  as described on criteria for speedy deletion  if the image is copyrighted under a non free license  per wikipedia fair use  then the image will be deleted hours after if you have any questions please ask them at the media copyright questions page  thank you  talk,fe02c83117f797ef,0.0,0.0,0.0,train,0.0,0.0,0.0,0
77734,68155,feces well done for the continued reversion of feces perhaps you might consider protecting the page to prevent the continued vandalism someone keeps englarging the image and placing it at the top jun utc ,b65545f197ee5d79,0.0,0.0,0.0,train,0.0,0.0,0.0,0
53793,158348, virus if he was infected with herpes simplex i  hsv i  then why not say that instead of a virus that usually causes cold sores  ,ec79c2c381d5351f,0.0,0.0,0.0,train,0.0,0.0,0.0,0
50463,134670, then please provide some way to explain what they look like  aerial blades isn t very descriptive of what they look like  also  four tildes  not just three to sign your comments  feeling chatty edits  ,d044b1b2d9ec37da,0.0,0.0,0.0,train,0.0,0.0,0.0,0
7747,46888,  meh  that s one reason i avoid political religious cultural articles like the bubonic plague  ,7d4fca86ae33971c,0.0,0.0,0.0,train,0.0,0.0,0.0,0
45126,24875, september utc until their site gets more press  it s a non issue  of course  when if they do  i have to admit i will look forward on principle to it s immediate recreation should they gain notability noteriety in the press to merit inclusion  t ,41c719f6d15fc063,0.0,0.0,0.0,train,0.0,0.0,0.0,0
105694,70627,leave me alone leave me the heck alone whore,bd04ff24e2746d27,0.0,1.0,0.0,train,0.0,0.0,1.0,1
85286,153051,hi dycedarg is there any way to get the  jerk  at who vandalized my page with disgusting pornographic insults  page  jeff boman i have a hunch who it is  a guy who threatened to mess up my page om another web forum i graduated from high school crap like that in this  jerk  needs to be taught a lesson in the law ,96a2578de1bb5d47,0.0,0.0,1.0,train,0.0,0.0,1.0,1
111577,84218,nightwish  metal ganres  and metal music  this is mainly in concern to your post on the nightwish page  please do not take this in any way  shape or form as an attack  but more as a offer of guidance i highly suggest  that when you read an article  you read it thoroughly  if you are unsure of the meaning of something  follow the link associated with it  and read the article about it  if a link is not provided  a good dictionary site such as this one should help in relevance to nightwish s musical style  they are not gothic  for reasons why  i suggest you read the articles symphonic metal and gothic metal in relevance to metal genre pages  and metal bands in genre  there is often discussion upon things to do with these  but low and behold  please be assured there is a dedicated network of users who work on this musical form  and the bands within  who are all highly experienced in the topic  and all work with  and sometimes against each other  to make the articles the best they can be please feel free to join any discussion on any page  but please read through previous disscussions  to see why the comments currently made  are being made hope you fair well  and thank you for the time taken to comment on nightwish s current talk page ,e14902bd8c50ff3b,0.0,0.0,0.0,train,0.0,0.0,0.0,0
59071,64690,about bunt article  hey do you have any photos of a guthu house and also korikatta,ad21ba805c6e65bc,0.0,0.0,0.0,train,0.0,0.0,0.0,0
36317,101194, muslim serb is an anachronism muslim serb is not an anachronism  serbia is a secular country  and the nationality of a serb is not denied if he is muslim  serbs have been forced to convert to catholicism and islam by foreign occupiers for centuries  namely german  austrian  hungarian  italian  papal  french  and ottoman turkish ones for centuries  ,1da63fa2eeb15f40,0.0,0.0,0.0,train,0.0,0.0,0.0,0
102877,131575,it shouldn t matter what an organisation calls its own members  al qaeda members are often described as terrorists on wikipedia  clearly they don t see themselves that way  one wonders why provos members aren t treated the same way  surely wikipedia isn t biased in favor of republican terrorism ,bff33cbe554ba95a,0.0,0.0,0.0,train,0.0,0.0,0.0,0
9280,110618,  please go back in time like a year and show your past self this edit  please make sure he stays calm  ,4fbddc4dd37bba52,0.0,0.0,0.0,train,0.0,0.0,0.0,0
101530,43466,it certainly appears that jz won t be happy until the article is either heavily critical or deleted ,7400871fb600cbfd,0.0,0.0,0.0,train,0.0,0.0,0.0,0
20989,152795, dabangg after some serious work on prose and references  i believe the article is almost ready to be nominated for ga  do you want to review it talk ,92b2c1ac08f2d5a6,0.0,0.0,0.0,train,0.0,0.0,0.0,0
25948,120016, heather la cunt  has also been trolling the licd forums  apparently  but can t even get her dates right and lied her ass off about the process and meetings involved in teletoon s theft of the show idea  preceding unsigned comment added by ,81c71e8c04546a31,0.0,0.0,0.0,train,0.0,0.0,0.0,0
75716,27154,edit  same for http reftag appspot com doiweb py doi f ,47d69a0f35312c30,0.0,0.0,0.0,train,0.0,0.0,0.0,0
67630,106942,br after i read the files ,3bdb8e338a7d2a29,0.0,0.0,0.0,train,0.0,0.0,0.0,0
50366,74179, the video is in and of itself a promotional item made for the purpose of reaching a large audience  which it has accordingly  this is a primary source which has been reliably published  by the church it contains flowers  own words about his religiosity and therefore not an independent third party as well as no analysis  synthesis  interpretation  or evaluation of the material is given the article states simply that he was featured on the church s website in a promotional video i see no need for a secondary source also  the secondary source you provided takes aim at the church s political position on same sex marriage which does not perhaps reflect the best views of mr  flowers  since there is no mention of his views personally  ,c677bc8baa37971e,0.0,0.0,0.0,train,0.0,0.0,0.0,0
31009,139386, if you dont like me leaving nasty messages and defacing your talk page  then stop deleting articles that you personally  unilaterally decide are irrelevant do not delete jesse mcgraw again  all information is relevant  not just the information you believe you have the right to pick and choose what gets preserved  who do you think you are  you fvcking as h le  ,ea07d5bdbdeb9253,0.0,1.0,1.0,train,0.0,0.0,1.0,1
52882,5200, utc  i ve changed it over to another free use image  we did use a crop from the same base photo once before  but the crop wasn t very good i ve recropped  and tried to clean it up a bit april,0dda97fe652022a7,0.0,0.0,0.0,train,0.0,0.0,0.0,0
26238,151075, hello islandbaygardener  in case you haven t seen it  i had set up the above on your  for you ,76f3d421e09f6625,0.0,0.0,0.0,train,0.0,0.0,0.0,0
107575,114383,management  people  changes as a resust of the lockheed martin merger,63bf23d908282bc4,0.0,0.0,0.0,train,0.0,0.0,0.0,0
23004,152223, episcopal high school sorry about my addition  i recognize that the drug use section was unneeded  and i added that before i recieved your message  but the section tab  recently  the reign of episcopal has begun a slight decline  the first sign of this was the new episcopal code episcopal students do not lie  cheat  steal  or chew gum on campus  this was taken to be a joke by many students  but alas  it was not  additionally  several excellent teachers have left  and recently one of most notable faculty  holocaust historian john iorii  has been asked not to renew his contract  these changes in the ehs experience began with the choice of former headmaster charlie zimmer to abdicate his title to dale regan  when asked about ms  regan  one student was quoted as saying  she seems to me to be a neo facist  and she talks entirely too slow  is an actual even that is happening at the school  this something that is just as worthy as being on the page as the noose section is  if you do not think the line when asked about ms  regan  one student was quoted as saying  she seems to me to be a neo facist  and she talks entirely too slow  is uncalled for  that is fine  it can be removed if neccessary  ,89b54ea671bed0ea,0.0,0.0,0.0,train,0.0,0.0,0.0,0
88342,82213,i am concerned that tbeatty keeps using comparisons involving peter roskam  a sitting rep and member of the gop  in good standing  and a convicted rapist and murderer  that s not kosher  that s kinda like when i get pissed off and start calling bush hitler i encourage tb to stop these comparisons involving peter roskam  who by all accounts is a fine christian man  and willy horton  if this continues i m gonna have to go to blp  if tbeatty needs to compare roskam and somebody else  i suggest he stick to other gop politicians  not a convicted a rapist murderer who never even held office i collegially suggest to my friend tbeatty that he pick tom delay  bob ney  or randy  duke  cunningham for comparative purposes willy horton s probably a dem anyway ,dbf747352d7a7e2a,0.0,0.0,0.0,train,0.0,0.0,0.0,0
123708,128922,redirect talk fuck the industry,b17307ef8cd39186,0.0,0.0,1.0,train,0.0,0.0,1.0,1
11139,50233,  that s an excellent point  though i would counter that in the case of pink floyd the vocals are samples  and in anesthesia the voice comes before the song starts  like an artifact from the recording process finally  in neither case are lyrics credited in the album sleeve  again  i understand that this seems to be nit picking  i just feel it s important to note that the band chose to include lyrics credited to their recently dead band mate in what would have otherwise been a instrumental  i think the way it s written now looks great and is  again  a good compromise  someone else please share their thoughts on that  ,8647304f7c6880bb,0.0,0.0,0.0,train,0.0,0.0,0.0,0
132852,10523,tachfin  i think you are an ignorant  a liar or you are not interesting in tell the true about administratives language in the sahrawi arab democratic because you are a sick moroccan  you like or you don  t like the spanish is the second language of the sahrawi arab democratic republic  and it is the second administrative language  what it means that spanish it not native language of sadr  i tell you that one language doesn  t need to be native  to be spoken  official or administrative language of one nation  i give now some of the official page of the sahrawi arab democratic republic  there are more  but i not going to lose more time with you  go to the school to learning polisario official site only in spanish rasd tv in spanish and arabic sadr national radio in spanish and arabic sahara salud only in spanish economic development ministry of the sadr in spanish and arabic saharaui magazine in spanish and arabic sahara film festival  only in spanish if you need more information about the spanish language in the sahrawi arab democratic republic  i can give you more ,1bc3b7dcdc2f0a7e,0.0,1.0,0.0,train,0.0,0.0,1.0,1
56623,18775, yeah the wording of the u s  regulations defining bourbon do not prohibit the lincoln county process  even if the process is used  is completely fuck  ing  retard ed so they might actually prohibit it if it wasn t used  but we are quite surprised to find they do not prohibit it if it is used fuck  ing  retard ed  one of you booze  nazi s needs to sober up and go fix that please hey you fartsniffing little wikitards instead of wasting time reverting my comments and oh banning my ip  oh no i ll need to sign up for more vpn s now why don t you fix it instead  ,318bb457237eaaf9,0.0,1.0,1.0,train,0.0,0.0,1.0,1
27982,87858, i am really disappointed with the dictatorship you wikipedia administrators carry out  in your particular case  you still want to imagine you are living in the meiji era  okinawa is not another country anymore  the okinawan tongue is a dialect of japanese  like it or not  it was established so by the government years ago  after carrying out extensive linguistic research  and realizing the grammar is the same palau  korean  and ainu are clearly not related i can t understand how wikipedia can let a soldier  a brutish animal without intelligence  closer to the neanderthal than to the homo sapiens  have more authority editing articles than an expert in the subject  and you americans are clearly the most  retard ed people on earth  now i see why americans in japan can only get the ugliest and most  retard ed women out there bitch es who  if they don t marry a  dumb  american  will end up single forever shame on you  wikipedia let me recommend you a site you may find interesting a site that shows how lots of people feel about the most unreliable encyclopedia on earth  http w smoblogger com wikipedia  suck s  ,eb0a34f670653f4e,0.0,0.0,0.0,train,0.0,0.0,0.0,0
20868,28154, crusades hey  s  schulz  amigo  stop screwing around with legitimate edits i put thus and ce in the crusades piece and you called it vadalism  how is that if you object to use of ce then suggest ad  but it seems to me that any piece that deals with events in the  th century should tell readers if you are talking ad or bc  and i don t know who put word jason in the article  but if your point in editing that was to refer to vandalism make very sure you don t overreach and call everything you take out as vandalism  you paint too wide a path when you do that and it s a misnomer so stop screwing around and get with the script rossp ,4a8c35bf19527a15,0.0,0.0,0.0,train,0.0,0.0,1.0,1
151430,17771,why is there a ga review on ww ii in the ulysses s  grant article ,2eeb3a6ff123625c,0.0,0.0,0.0,train,0.0,0.0,0.0,0
62678,116439,and now censor this too ,6e6a6e36e65ad8da,0.0,0.0,0.0,train,0.0,0.0,0.0,0
5572,21281,  i own this material all dates and version i own the usa copyright of this material joseph e bressman the gas theory by joseph e bressman this is my usa copyright symbol copyright on file in the usa i own all dates all version and every form of this theroy synopsis  the gas theory is the occupied space theory  this theory states that the universe was originally all matter  the theory is based on the fact that a vacuum can only be created when work is done  the exact proportion and density of the original matter is not known  it is only an educated guess that the matter was a gas  the gas theory states space is infinite n matter is infinite n time is infinite energy is the reactant  n matter energy n space n matter energy the starting point is theoretical  matter n n energy space n matter n n energy n over n equals an open proportion an unknown balance  since the universe is not subject to proportion  all things are technically part of a type of gas the gas theory  the gas theory states that a gas in some low density form or equal to or proportional to infinite times a helium atom  or any particle matter space energy  is was the original substance a property less gas  this gas had potential energy  ironically only because it was substance and had mass  this gas was  at a single volume  pressure  and temperature  first the gas condensed some  then the gas developed some properties st  the variation of volume  created the weak force from vacuum matter  nd  the variation of pressure  created gravitation from condensation matter  rd  the variation of temperature  created electromagnetism from hot and cold p t v  matter  th  friction developed  kinetic energy this caused electrical activity  condensations and  dynamic cosmic relationships a gaseous energetic cloud of microwave laden matter energy reactions  all these caused and created the strong force  highly kinetic and condensed matter  which lead to  spontaneous disintegration s and atomic radiation  all this lead to the universe as we know it matter which we know exists and is the basis for all things remains the foundation of all things  with the big bang nothing must become something with gas theory matter creates space from a void in matter the events that are described are reasonable and logical because there is something matter  if there were nothing even nothing is something however  if there were nothing then life could not exist  the math n infinite quantity any number not not negative n x of a helium atom a gas  matter the universe  calculated at the starting point n matter and n space n energy  time so n matter n space n energy will equal n matter  n space n energy  time space was created by this  a void was opened  this is the gas theory math spoken infinite matter and little space equals infinite space and little matter with energy being the reactant or matter space plus energy plus time equals space matter minus energy minus time matter space  n energy space matter n energy  n infinite not not any negative numbers  joseph e bressman  a vacuum can only be created when work is done  ,381c5f5ee47be086,0.0,0.0,0.0,train,0.0,0.0,0.0,0
45938,14497, some minor changes i wrote rabbi in front of r  yosef  and r  eliashiv s names  and added that decisions by the conservative board of rabbis are somewhat respected in the reform and reconstructionist community but do not carry any signicance for orthodox jew s  who do not recognize their authority  removed do not carry any signicance for orthodox jew s  who do not recognize their authority because this is implied  ,2646663d237703dd,0.0,0.0,0.0,train,0.0,0.0,0.0,0
26327,130402, help hey i like the way you have your profile  especially the part where you put some of the words a diffrent colour un poco sobre mi  and some articles i ve contributed to and i was wondering if you can help me  if you want and have the time to  i dont want to force you nor take your time  thanks for reading  ,b99857648fa10ca7,0.0,0.0,0.0,train,0.0,0.0,0.0,0
61450,136313,also  i still think that you should have simply left a message here asking me to change it  and if i had have gone to dispute thingy  depending on who was there  it could have gone either way  afa ,d93a5a4332223d00,0.0,0.0,0.0,train,0.0,0.0,0.0,0
93543,60498,i m not an imer  that s not a hostile response  it s just a fact  i don t even know how to do an im  and to the extent i am familiar with it i ve disabled it because of all the warnings about viruses  in any case  it s in the morning here in seattle and i ve got to get off to bed  we can continue this later  incidentally  i ve been in contact with the usmc  and i expect to get a reasonably complete copy of the investigative report on sanchez  will that be an acceptable secondary source  or will there be some wikipedia pillar principle that will be used to omit it ,a1f272ac2ca00193,0.0,0.0,0.0,train,0.0,0.0,0.0,0
113187,25323,not know to this day what devil brought them into our country  we did not fetch them from jerusalem yes  we have and hold them captive  as i would like to keep my rheumatism  and all other diseases and misfortunes  who must wait as a poor servant  with money and property and everything i have  i wish they were in hell with the other jew s and whomsoever they would like to have with them ,4305bf54356fac88,1.0,0.0,0.0,train,0.0,0.0,1.0,1
95050,137686,i see no reason for it being removed from the article  if people do not like it being called a staple food  then their are easy solutions none of which require removing it  it is notable  it is cited  it is npov  it is relevant ,e0c3bd73307893a9,0.0,0.0,0.0,train,0.0,0.0,0.0,0
45982,50612, somebody has requested this article  and i have done  almost  my best to comply  thanks to mr  deb for changing my stupid present tense into past tense i have not linked the first mention of peter the great  because i hope to eliminate it soon enough by creating the article pierre lefort itself  thus making the explanatory note following his name unnecessary i hope the unknown requester may enjoy and find the stuff useful  ,8751c83f5b042893,0.0,0.0,0.0,train,0.0,0.0,0.0,0
53906,149625, war should have its own page i think this whole war should have a page of its own  it s a bit redundant to be mentioning it on different pages such as ebaum s world as well as here  the content is a bit off  now the problem is  what ll the page be named  personally i like w ,5edb33cf8db45535,0.0,0.0,0.0,train,0.0,0.0,0.0,0
