,Unnamed: 0,comment_text,id,identity_hate,insult,obscene,set,severe_toxic,threat,toxic,toxicity
126499,83868,robert ullmann  suck s dick robert ullmann  suck s dick robert ullmann  suck s dick robert ullmann  suck s dick robert ullmann  suck s dick robert ullmann  suck s dick robert ullmann  suck s dick robert ullmann  suck s dick robert ullmann  suck s dick robert ullmann  suck s dick robert ullmann  suck s dick robert ullmann  suck s dick robert ullmann  suck s dick robert ullmann  suck s dick robert ullmann  suck s dick robert ullmann  suck s dick robert ullmann  suck s dick robert ullmann  suck s dick robert ullmann  suck s dick robert ullmann  suck s dick robert ullmann  suck s dick robert ullmann  suck s dick robert ullmann  suck s dick robert ullmann  suck s dick robert ullmann  suck s dick robert ullmann  suck s dick robert ullmann  suck s dick robert ullmann  suck s dick robert ullmann  suck s dick robert ullmann  suck s dick robert ullmann  suck s dick robert ullmann  suck s dick robert ullmann  suck s dick robert ullmann  suck s dick robert ullmann  suck s dick robert ullmann  suck s dick robert ullmann  suck s dick robert ullmann  suck s dick robert ullmann  suck s dick robert ullmann  suck s dick robert ullmann  suck s dick robert ullmann  suck s dick robert ullmann  suck s dick robert ullmann  suck s dick robert ullmann  suck s dick robert ullmann  suck s dick robert ullmann  suck s dick robert ullmann  suck s dick robert ullmann  suck s dick robert ullmann  suck s dick robert ullmann  suck s dick robert ullmann  suck s dick robert ullmann  suck s dick robert ullmann  suck s dick robert ullmann  suck s dick robert ullmann  suck s dick robert ullmann  suck s dick robert ullmann  suck s dick robert ullmann  suck s dick robert ullmann  suck s dick robert ullmann  suck s dick robert ullmann  suck s dick robert ullmann  suck s dick robert ullmann  suck s dick robert ullmann  suck s dick robert ullmann  suck s dick robert ullmann  suck s dick robert ullmann  suck s dick robert ullmann  suck s dick robert ullmann  suck s dick robert ullmann  suck s dick robert ullmann  suck s dick robert ullmann  suck s dick robert ullmann  suck s dick robert ullmann  suck s dick robert ullmann  suck s dick robert ullmann  suck s dick robert ullmann  suck s dick robert ullmann  suck s dick robert ullmann  suck s dick robert ullmann  suck s dick robert ullmann  suck s dick robert ullmann  suck s dick robert ullmann  suck s dick robert ullmann  suck s dick robert ullmann  suck s dick robert ullmann  suck s dick robert ullmann  suck s dick robert ullmann  suck s dick robert ullmann  suck s dick robert ullmann  suck s dick robert ullmann  suck s dick robert ullmann  suck s dick robert ullmann  suck s dick robert ullmann  suck s dick robert ullmann  suck s dick robert ullmann  suck s dick robert ullmann  suck s dick robert ullmann  suck s dick robert ullmann  suck s dick robert ullmann  suck s dick robert ullmann  suck s dick robert ullmann  suck s dick robert ullmann  suck s dick robert ullmann  suck s dick robert ullmann  suck s dick robert ullmann  suck s dick robert ullmann  suck s dick robert ullmann  suck s dick robert ullmann  suck s dick robert ullmann  suck s dick robert ullmann  suck s dick robert ullmann  suck s dick robert ullmann  suck s dick robert ullmann  suck s dick robert ullmann  suck s dick robert ullmann  suck s dick robert ullmann  suck s dick robert ullmann  suck s dick robert ullmann  suck s dick robert ullmann  suck s dick robert ullmann  suck s dick robert ullmann  suck s dick robert ullmann  suck s dick robert ullmann  suck s dick robert ullmann  suck s dick robert ullmann  suck s dick robert ullmann  suck s dick robert ullmann  suck s dick robert ullmann  suck s dick robert ullmann  suck s dick robert ullmann  suck s dick robert ullmann  suck s dick robert ullmann  suck s dick robert ullmann  suck s dick robert ullmann  suck s dick robert ullmann  suck s dick robert ullmann  suck s dick robert ullmann  suck s dick robert ullmann  suck s dick robert ullmann  suck s dick robert ullmann  suck s dick robert ullmann  suck s dick robert ullmann  suck s dick robert ullmann  suck s dick robert ullmann  suck s dick robert ullmann  suck s dick robert ullmann  suck s dick robert ullmann  suck s dick robert ullmann  suck s dick robert ullmann  suck s dick robert ullmann  suck s dick robert ullmann  suck s dick robert ullmann  suck s dick robert ullmann  suck s dick robert ullmann  suck s dick robert ullmann  suck s dick robert ullmann  suck s dick robert ullmann  suck s dick robert ullmann  suck s dick robert ullmann  suck s dick robert ullmann  suck s dick robert ullmann  suck s dick robert ullmann  suck s dick robert ullmann  suck s dick robert ullmann  suck s dick robert ullmann  suck s dick robert ullmann  suck s dick robert ullmann  suck s dick robert ullmann  suck s dick robert ullmann  suck s dick robert ullmann  suck s dick robert ullmann  suck s dick robert ullmann  suck s dick robert ullmann  suck s dick robert ullmann  suck s dick robert ullmann  suck s dick robert ullmann  suck s dick robert ullmann  suck s dick robert ullmann  suck s dick robert ullmann  suck s dick robert ullmann  suck s dick robert ullmann  suck s dick robert ullmann  suck s dick,e06fee23625b5da8,0.0,1.0,1.0,train,0.0,0.0,1.0,1
109722,9711,moving on  poll  question  in words  more or less  what do you object to  in the article in its present protected state answers  it s protected  i think protected articles are contrary to wikipedian principles jun utc ,19b8087b6e3c5d1b,0.0,0.0,0.0,train,0.0,0.0,0.0,0
40428,13999, please do not vandalize pages  as you did with this edit to audrina patridge  if you continue to do so  you will be  block  from editing  ,24ef0041e71b6117,0.0,0.0,0.0,train,0.0,0.0,0.0,0
85111,143546,hi  you have made very sensible edits in the past and wonder if you would mind looking at the abortion page  i have gotten into an edit war with jtdirl and would appreciate your take on it  the war is primarily about style  i have tried to make the article less wordy and better organized  but i think there is an underlying npov issue  not concerning the matter of abortion  pro vs  con  but concerning the role of wikipedia  to educate people about ongoing public debates over certain issues  or to provide logical arguments meant to provoke people s thoughts right now there is an extensive account in the talk page  if you look at the article make sure to find out whose reversion it is well  i hope you are having a good holiday  if you celebrate it ,ffa54a83cecf88d7,0.0,0.0,0.0,train,0.0,0.0,0.0,0
99782,143098,in fact  there appears to be only one article about a single lawsuit  maybe multiple filings and links to other court cases  this is simply original research and all court cases should be removed ,fd42d24686de0bc0,0.0,0.0,0.0,train,0.0,0.0,0.0,0
85305,39596,hi everyone  welcome to my talk page category user talk pages,69b19604fb488e4f,0.0,0.0,0.0,train,0.0,0.0,0.0,0
151411,93373,why is slim virgin so interested in all of these controversial jew  related topics oh  that s right  its because she is defending the jew ish faith except that her entire point of view  on all of the topics  opposes the wishes of jew ish people perhaps slim virgin is angry at something perhaps she is the embodiment of this article ,f9a4f69a02bbd0cd,0.0,0.0,0.0,train,0.0,0.0,0.0,0
40496,159257, please do not vandalize pages  as you did with this edit to charles dickens  if you continue to do so  you will be  block  from editing  push my button  ,fafe02b1e7bdd24d,0.0,0.0,0.0,train,0.0,0.0,0.0,0
130958,159363,south eastern railway the section on accidents needs expanding  maybe you could cull some accidents from various line articles  such as the seml ,fc7c3f16c920ac6a,0.0,0.0,0.0,train,0.0,0.0,0.0,0
80811,120177,good luck well i wanted to be the first one to wish you good luck  i have done everything i can to stop this stupidity but unfortunately they keep letting fram do w hate ver he wants  i expect to be  block  myself soon because i told that piece of trash what i thought of him on the discussion so i think its only a matter of time before someone blocks me for personal attacks  of course they ll leave him be to continue his crusade against some other editor ,82c05d005dbe7990,0.0,0.0,0.0,train,0.0,0.0,0.0,0
148658,26492,well they re about to loose that privilege many people on that page are now all coming to the same conclusion that they ve turned the page into chaos  it s not just me i d also appreciate it if you d mind your own business thanks ,462eb8590bb9bd11,0.0,0.0,0.0,train,0.0,0.0,0.0,0
115387,109948,ok  cool  keep me posted ,4c14672e1643e4cf,0.0,0.0,0.0,train,0.0,0.0,0.0,0
73651,64915,didn t you like my present here s a fresh one  if you got the last one dirty ,adb6700c29d4d0c5,0.0,0.0,0.0,train,0.0,0.0,0.0,0
98332,63048,if that s the  nd quest  yes ,a8adf050d05e8a8e,0.0,0.0,0.0,train,0.0,0.0,0.0,0
40373,80084, please do not replace wikipedia pages or sections with blank content  it is considered vandalism  please use the sandbox for any other tests you want to do  take a look at the welcome page if you would like to learn more about contributing to our encyclopedia  thanks dakota ,d6479081e1fc7a5f,0.0,0.0,0.0,train,0.0,0.0,0.0,0
103919,151906,jinxmchue apparently  i screwed up when i asked  if he plans to constructively edit any pages after his block expires he s now editing at user talk making the same complaints as usual i placed a rangeblock on which went over like a lead balloon  see wp an i jinxmchue ip rangeblock there s some discussion there and some questions about why he was  block  in the first place i removed the rangeblock and the protections i put on the talk pages earlier  but there s an unblock request at user talk i don t know if you want to provide some explanation  but i figured you might want to at least know about it it looks like i ve caused the interpersonal fiasco that i knew i d cause right after christmas good going on my part  elkspeak ,849ebd1f0e3a2393,0.0,0.0,0.0,train,0.0,0.0,0.0,0
130531,65656,sorry chief  i d had a drink and perhaps was a little thoughtless  i didnt mean to sound so baity sorry  dear boy toodle oo,afa5af8b851f0a74,0.0,0.0,0.0,train,0.0,0.0,0.0,0
140978,147676,there you happy  i posted a link fuck you and fuck jimbo w hate ver ,401e5952b1da4959,0.0,1.0,1.0,train,0.0,0.0,1.0,1
46845,66575, start with the fact that wikipedia is not a dictionary continue with the fact that wikipedia is not in and of itself a reliable source what a redirect on wikipedia points to has absolutely nothing to do with anything ask  say  m w com  y know  an actual dictionary  the same thing and you ll see what the difference is  see definition for which there is no equivalent for the the word inculcate  indoctrinate has negative bias connotations  inculcate does not  ,b225d7d6ef67a37e,0.0,0.0,0.0,train,0.0,0.0,0.0,0
112134,110001,no discussion  so i made the above edits ,4c741e50e1f364f4,0.0,0.0,0.0,train,0.0,0.0,0.0,0
139212,13172,the problem i have is that from my understanding  london  the region of england is the exact same thing as london  the city  both are conurbations and have no administrative role within uk government  this article is currently suggesting that  london  as a city is only a convention when really  there is a legal entity know as  london the region which effectively acts as the capital city of the united kingdom  i agree that greater london and london are separate entities  and deserve separate articles however currently there are two articles cover the same region known as  london i think that the region known as  london  should removed from the greater london article and this article should show that london is a region commonly described as a city  regards ,22dc26577d0d5644,0.0,0.0,0.0,train,0.0,0.0,0.0,0
144439,149645,u smell its contaygius,5f287347dcce8395,0.0,1.0,0.0,train,0.0,0.0,0.0,1
87527,154930,i  hate  you you just do things anyhow and as you please as if you father owns wikipedia  you just delete articles anyhow also  dont let me catch u one day else i ll kill you  watchout dawg  u just played with fire ,b64cbfe7f4a854b0,0.0,1.0,0.0,train,0.0,1.0,1.0,1
16783,46843, another silk purse award silk purse awardi am both pleased and honored to present you with another silk purse award in appreciation for your superb improvements to the fire from the heartland article  essentially changing what was seen as a sow s ear stub into a terrific silk purse start  michael q  ,7d36bf9885886ded,0.0,0.0,0.0,train,0.0,0.0,0.0,0
59789,19642,added to the sentance you mentioned ,33e3467060f931ad,0.0,0.0,0.0,train,0.0,0.0,0.0,0
87284,102394,http w statistics gov uk cci article asp id shows that for most of the last thirty years  inflation in the uk has hovered between and per cent  even at the uppermost figure  you wouldn t have expected prices to increase more than per cent between and when in fact they ve increased per cent  if we could find a published quote referring to price complaints  this would be ironclad  but even if we can t i still feel it s decent content  after all  it s much better supported than most of the stuff in the article and people are only objecting to it because it s criticism ,23fdb30fd6f778f2,0.0,0.0,0.0,train,0.0,0.0,0.0,0
60163,92216,afd please see wikipedia articles for deletion maps of american ancestries  it s an interesting article  but imo not suitable for an encyclopedia  feel free to disagree  or agree  thanks ,f687899e940b73a1,0.0,0.0,0.0,train,0.0,0.0,0.0,0
52801,59750, uses i removed this section from the page in southeast asia  the roots of the plant are used cosmetically medicinally to  all right  i can t remember what they re supposed to be good for  someone else please fill this in  it can also be used as an insecticide  it can kill a house fly research in cogon grass as a insecticides is done by the researches of uplb since it admits at a meta level that it is incomplete  the discussion page is for discussion i don t have the expertise to fix it  but a complete uses section would be great  ,9ffc3dc04f335935,0.0,0.0,0.0,train,0.0,0.0,0.0,0
144294,72714,two points  don t talk to me in template form  that is contrary to wp civil  i know how much you guys like the rules round here  who have i insulted exactly  when you accuse someone of something  its better to use some evidence ,c28ab5c968a86219,0.0,0.0,0.0,train,0.0,0.0,0.0,0
37728,134538, notability of ms peachez a tag has been placed on ms peachez requesting that it be speedily deleted from wikipedia  this has been done because the article appears to be about a real person  organization  band  club  company  etc or web content  but it does not indicate how or why the subject is notable  that is  why an article about that subject should be included in an encyclopedia  under the criteria for speedy deletion  articles that do not indicate the subject s importance or significance may be deleted at any time  please see the guidelines for what is generally accepted as notable  if this is the first page that you have created  then you should read the guide to writing your first article if you think that you can assert the notability of the subject  you may contest the deletion by adding  to the top of the page  just below the existing speedy deletion or db tag coupled with adding a note on the article s talk page explaining your position  but be aware that once tagged for speedy deletion  if the article meets the criterion it may be deleted without delay  please do not remove the speedy deletion tag yourself  but don t hesitate to add information to the article that would confirm the subject s notability under wikipedia guidelines for guidelines on specific types of articles  you may want to check out our criteria for biographies  for web sites  for bands  or for companies  feel free to leave a note on my talk page if you have any questions about this blanchardb  myears mymouth timed  ,cf70f9a158db156c,0.0,0.0,0.0,train,0.0,0.0,0.0,0
61679,22353,also i ve actually been on wikipedia for many years  this is not my first account although i don t see how long someone being a member here gives them more rights and say so s when that s not the point of this site ,3af95a148d7beec0,0.0,0.0,0.0,train,0.0,0.0,0.0,0
79742,840,gba i ve found out a game boy advance version of this was released  there s no mention of it in the article as we know the current acclaim doesn t have rights to this series  information may be scarce ,0248b6392114c724,0.0,0.0,0.0,train,0.0,0.0,0.0,0
110369,47910,my personal experience does provide the context for my interpretation of reliable sources  but i don t use it as a basis on which to add remove or modify information  and i am able to commit to this ,8004bb41bfa369c8,0.0,0.0,0.0,train,0.0,0.0,0.0,0
81977,92617,hasbro this article says that infogrames owns hasbro but then it says they sold some things to hasbro and the hasbro page doesn t say they are owned by infogrames ,f7afeb611124e29b,0.0,0.0,0.0,train,0.0,0.0,0.0,0
136045,69404,thanks so much kevin  your input is so much appreciated  best ,b9a5331ae88719f1,0.0,0.0,0.0,train,0.0,0.0,0.0,0
134505,62129,thank you that fixed i didnt even think to look there  great help,a63aeffdbf4650f6,0.0,0.0,0.0,train,0.0,0.0,0.0,0
134260,107872,thank you for your comments  please click for my rebuttal,4099ea3dabbd024c,0.0,0.0,0.0,train,0.0,0.0,0.0,0
143157,111555,tim vickers you are a failed human thus a dud  you did not evolve from a zombie ,54cf1cdc60e5368d,0.0,0.0,0.0,train,0.0,0.0,1.0,1
74340,37168,do you spit or swallow ,6332281cbcaca42f,0.0,0.0,0.0,train,0.0,0.0,1.0,1
112568,139383,no problem thanks for the tip about putting in an edit summary i too have been removing premature ef  ratings to the tuscaloosa tornado ,ea050edb9319ff52,0.0,0.0,0.0,train,0.0,0.0,0.0,0
83769,102189,here s one for you  shut up you sad  sad  bastard regards your friendly neighbourhood go on  block me  have fun dealing with the  new  me after that ,22de2bc0ae9b4440,0.0,1.0,1.0,train,0.0,0.0,1.0,1
105882,78604,let s do that then ,d255210f573f8cd5,0.0,0.0,0.0,train,0.0,0.0,0.0,0
47848,21196, team roster moved from user talk kevin mce  hi there  i wonder if you might be able to clarify your reason for making this edit where you cited wp crystal  i m not clear on why the information you removed is inappropriate  thanks  i don t know what needs to be explained we cannot say with certainty that those riders will ride for that team next year  because we do not know the future an encyclopaedia reports facts  not expectations  hi again  firstly  i moved your comment back here to keep this in one place so it is easier to follow  i am still not clear exactly what at wp crystal makes this content inappropriate  this is not a predicted team roster  it is verifiable and very likely to be accurate since the chance of team sky confirming they have signed a contract with a rider for and then that not happening must be very slim  it is verifiable that these men have signed to ride for that team next year  that is in the preceding paragraph and i would not challenge the appropriateness of stating that a roster  not a word that should be used on an article about a uk subject  but that is a different matter  is not something that exists in and even as a speculative list  it is so incomplete as to be meaningless  it also does not use the cycling squad template which is standard for team articles  but these are not the point returning to the crystal balling issue  you say yourself that the chance of them not riding is very slim  you thus acknowledge that this is a possibility  and therefore their inclusion in the squad is not a definite fact let s hope it doesn t happen  but sky might go bust  or any one of the signed riders might have a career ending injury  before january  in which case will arrive  they will not be part of the team  and the encyclopaedia will be guilty of having recorded an error facts  not expectation  i will happily accept that the signing of a contract to ride for the team in doesn t mean that any of these will actually ride for the team in and that the team might not even exist  however  all these riders have been signed up to ride for the team in that makes them part of the squad for we re not simply expecting them to be  they are confirmed to be  surely though  we would be speculating if we were to disregard that and suggest it might not happen  i think you are misinterpreting wp crystal  i d suggest that it makes it clear that it is perfectly acceptable to include details of future events providing the information is verifiable  as is the case here  if it turns out that any or all of these riders don t ride for team sky in then the wikipedia article won t have been guilty of having recorded an error because it was an entirely accurate description of the situation at this time based upon the information available  i m not saying that it won t happen  nor that it is not very likely  but that it is expectation  not fact you speak of verifiability  but life teaches us that the future is not verifiable if they were to die before the end of this year  they will not be in the team  the future is not confirmed an entirely accurate description of something that does not currently exist is not possible  and as a description  a man top level racing squad is not entirely accurate i find your position on this matter a little strange  you seem to want to defend the article from speculation but in doing so  seem to be introducing your own speculation that the team might not exist or the riders might change  the names that are being announced are for the squad  so it seems perfectly appropriate to describe the list as such  we can  and should  only base the article on what can be verified at the current time  and that is that the riders named are part of the team for the information we have at the current time says these individuals are confirmed to ride for the team in and our article is  and should  only ever be based upon information available at the time  i would note that  not only has another user reverted the change you made which i am concerned about here  but also that a further ten names have been announced,37e9d340151a8d1f,0.0,0.0,0.0,train,0.0,0.0,0.0,0
23116,154921, ethnic violence i think the following paragraph should be removed from the article it has been suggested that the random violence was a delayed response to crime perpetrated by other middle easterners  such as gang rapes that occured in and my main problem with it is that the claim being put forward is totally unsourced and unsupported  yes  whoever put it in has provided an article from the australian as a source  however  if you actually read this article  it doesn t say anything of the sort about the violence being some kind of delayed response to events in and in fact  it only mentions rape once  here is the relevant section of the article in an article on this page nearly two years ago don t turn a blind eye to terror in our midst  january i argued that the increasing frequency of racially motivated attacks on young australian men and women including murders  gang rapes and serious assaults by young men of lebanese muslim descent would rise dramatically throughout australia  these problems remain widespread and have been documented in the ensuing two years so no mention of any kind of delayed response  therefore  the idea is completely the pov of whoever wrote it  hiding behind a misrepresented source  it should go  ,b60c7826e9b8e130,0.0,0.0,0.0,train,0.0,0.0,0.0,0
22076,89318, documentary  fragmentary  or supplementary it looks like parts of this article were written without regard to the rest of the article  two examples are the fact that there are two sections called legacy and his legacy  and that the same quote he who believes  appears twice in the article with different  trans lations  ,eeebc689734786b4,0.0,0.0,0.0,train,0.0,0.0,0.0,0
93656,106350,i m not sure how this is contributing to the article  but i have been involved in several law suits in my day they are extreemly time resource consuming and very expensive like the cost of a lawsuite can be more than the total value of the business doing the suing rarely does it make any sense,390dfc20b85b9eb8,0.0,0.0,0.0,train,0.0,0.0,0.0,0
78303,83468,firstly the nairs were prominent from far earlier than the th century eg the aaruveetil madambis who were sent in ad to protect the kandiyur temple inscriptions dating back a years mentioning these madambis even today exist in kandiyur ambalam  so that point  stating that they gained ascendancy because of namboodiris is wrong  these madambis were kiriyathil nairs who donot allow their womenfolk to marry from other castes  nevertheless  ive heard of the cold war that exists between the nairs and ezhavas and very often i hear that the nss and sndp keep opposing each other etc etc  ,df503ef9e6e7f1db,0.0,0.0,0.0,train,0.0,0.0,0.0,0
102328,11115,it s called a content dispute  and your repeated accusations of vandalism are the actual problem here  o  ,1d5da604bb056e85,0.0,0.0,0.0,train,0.0,0.0,0.0,0
34996,83989, maintains his innocence in the baby photo imbroglio  furtive machinations and real life threats to my family and livelihood by an anonymous deviant prevent me from exonerating myself in the baby photo imbroglio in consultation with my family and spiritual advisor  i have made the difficult decision to permanently disengage myself from all contact with the usual suspect of wikipedia content dispute  may god be with you all  ,e0c72361bdc39878,0.0,0.0,0.0,train,0.0,0.0,0.0,0
