,Unnamed: 0,comment_text,id,identity_hate,insult,obscene,set,severe_toxic,threat,toxic,toxicity
5540,86370,  i moved it to match the product logo at least there should be something mentioning how windows phone and windows mobile is related  talk contributions changing the world one edit at a time ,e6fc78bac046fc8d,0.0,0.0,0.0,train,0.0,0.0,0.0,0
126471,141719,road speed  side says road speed is that km h  artcle says mph which converts to km h so just wondering  not sure,f63f6570a90208cb,0.0,0.0,0.0,train,0.0,0.0,0.0,0
18024,34399, baby got back section  oh my god becky  look at her butt it is so big  uh she looks like one of those rap guys girlfriends  but  uh  y know  uh who understands those rap guys uh they only talk to her because she looks like a total prostitute  okay i mean her butt it s just so big  uh i can t believe it s just so round it s like out there i mean  uh  gross look  uh  she s just so black i like big butts and i can not lie you other brothers can t deny that when a girl walks in with an itty bitty waste and a round thing in your face you get sprung wanna pull up front cuz you notice that butt was stuffed deep in the jeans she s wearing i m hooked and i can t stop staring oh  baby i wanna get with ya  and take your picture my homeboys tried to warn me but with that butt you got makes me so horny ooh  rump of smooth skin you say you wanna get in my benz well use me use me cuz you aint that average groupy i ve seen them dancin to hell with romancin  sweat  wet  got it goin like a turbo vette i m tired of magazines saying flat butts are the thing take the average black man and ask him that she gotta pack much back so fellas has your girlfriend got the butt  tell her to shake it  shake that healthy butt baby got back i like em round and big and when i m throwin a gig i just can t help myself i m actin like an animal now here s my scandal i wanna get you home and uh  double up uh uh i aint talkin bout playboy cuz silicone parts are made for toys i wann em real thick and juicy so find that juicy double mixalot s in trouble beggin for a piece of that bubble so i m lookin  at rock videos knockin  these bimbos walkin  like hoes you can have them bimbos i ll keep my women like flo jo a word to the thick soul sistas i wanna get with ya i won t cus or hit ya but i gotta be straight when i say i wanna uh till the break of dawn baby got it goin on a lot of won t like this song cuz them punks like to hit it and quit it and i d rather stay and play cuz i m long and i m strong and i m down to get the friction on so ladies if you wanna roll my mercedes then turn around stick it out even white boys got to shout baby got back baby got back yeah baby when it comes to females cosmo ain t got nothin to do with my selection uh uh only if she s so your girlfriend rolls a honda playin  workout tapes by fonda but fonda ain t got a motor inna  back of her honda my anaconda don t want none unless you ve got buns hon you can do side bends or sit ups  but please don t lose that butt some brothers wanna play that hard role  and tell you that the butt ain t gold so they toss it and leave it and i pull up quick to retrieve it so cosmo says you re fat well i ain t down with that cuz your waste is small and your curves are kickin and i m thinkin bout stickin to the beanpole dames in the magazines you aint it miss thing give me a sista i can t resist her red beans and rice didn t miss her some knucklehead tried to dis cuz his girls are on my list he had game but he chose to hit  em and i pull up quick to get wit  em so ladies if the butt is round and you wanna triple x throw down dial mixalot and kick them nasty thoughts baby got back baby got back little in the middle but she got much back ,5be21e25bd1664e1,0.0,0.0,0.0,train,0.0,0.0,1.0,1
108368,24759,me again  given that there are some gaping holes left to be filled between what we have already agreed  and what needs to be agreed to finish the job  where do you thing we should go from here  cheers ,417b337daa32c64d,0.0,0.0,0.0,train,0.0,0.0,0.0,0
14063,158867,  you believe that the correctness of the image caption should be measured against what you believe is an accurate paraphrase rather than the actual language of the source whose meaning is being represented  so  who appointed you god ,f511b7b52d94652d,0.0,0.0,0.0,train,0.0,0.0,0.0,0
65245,2855,ask chris hypocrite org how it happened  he answer to my e mail to  unblock en l lists wikimedia org the time differences are because local timing on wednesday march andrew serafin wrote in my first note i forgot to mention my ip address thank you this address has now been  block  for your violation of the block  placed on serafin and the block on the serafin account has been extended so richard it is wasting of you time and mine  those who like revenges  sense of power  in fact only the surrogate of power  or have similar sickness will in present system parasite on good will and effort of others  wikipedia need work and redactors not the cranky sheriffs  self qualified teutonic knight etc  i am not against free editions  different point of views but i am against exchange blows  the present complicated snake pit must be burn up  andrew,07b4c74a0bddbe18,0.0,0.0,0.0,train,0.0,0.0,0.0,0
9984,109031,  she obviously has personal beliefs on those issues  but there s not any evidence they inform her political positions we have evidence to the contrary,46edf27da53e38fd,0.0,0.0,0.0,train,0.0,0.0,0.0,0
2486,84797,  excepting one edit in ,e2e96808935bab71,0.0,0.0,0.0,train,0.0,0.0,0.0,0
34938,126593, m never touching hawaii hotspot again  at least for,a5181ac7f6e91f82,0.0,0.0,0.0,train,0.0,0.0,0.0,0
148192,140492,well  the last time i was there  the board with the name of the village was standing  maybe not any more  regards ,efd606d4bf7715f3,0.0,0.0,0.0,train,0.0,0.0,0.0,0
78473,81401,follow the money to wikipedia from the circumcision lobby jimbo sold out mankind ,d9bd2771766bf574,0.0,0.0,0.0,train,0.0,0.0,0.0,0
5744,54626,  i still don t think unlettered should appear in the infobox beside education as that is over simplifying the situation  i m all in favour of this fact and its significance as determined by scholars appearing in the article  though talk to me  ,9207d8aecdf139b3,0.0,0.0,0.0,train,0.0,0.0,0.0,0
117137,107962,or else it is in violation of wp synthesis and wp or we are not here to make debates but simply insert reliable sources the introductions from encyclopaedia of islam  encyclopaedia iranica and encyclopaedia britannica can provide a good guidelines as well ,4117d9e071f285d6,0.0,0.0,0.0,train,0.0,0.0,0.0,0
1399,28031,  before the israelis had f s,4a275e4f0537b1eb,0.0,0.0,0.0,train,0.0,0.0,0.0,0
106206,4263,link to wikimedia commons,0b61e612bef4693e,0.0,0.0,0.0,train,0.0,0.0,0.0,0
92901,124111,i ll admit i find this analysis rather strange myself but i looked it up at surlalune fairy tales and apparently it s copied almost literally from there  some literary analyst who dissected this fairy tale came up with it ,97cc455611d2fd5a,0.0,0.0,0.0,train,0.0,0.0,0.0,0
144412,57300,u my fat furry friend are a  cunt  stop fuck  in talkin,99359522d8da9c96,0.0,1.0,1.0,train,0.0,0.0,1.0,1
46015,112646, something sinister  blar blar  lemming ,5aa4bb2d41eede76,0.0,0.0,0.0,train,0.0,0.0,0.0,0
64487,32177,arion  you are confusing neutrality with factuality  being neutral does not mean one must abandon all tests for truth  or be tolerant of misrepresentations of fact  and i shall repeat once again that you should absolutely not be editing this article  since as a homeopath you are clearly an interested party  that s coi ,558d254644d33596,0.0,0.0,0.0,train,0.0,0.0,0.0,0
94352,99637,i nominated it with a  and g i think i am right with both  your thoughts ,150e93d7cea6f052,0.0,0.0,0.0,train,0.0,0.0,0.0,0
117934,7369,paul byrd  why did you undo my constructive edits to the paul byrd article  it is well known that he has a pig nose and mentions it in his book ,1393dd7d8403503d,0.0,0.0,0.0,train,0.0,0.0,0.0,0
99610,133472,improbable a person mining mineral coal is a collier  so is a coal ship a wood collier is a person who made coal  i e  charcoal  from wood conceivably the two might have the same indo european root ,ca0bfc9b8716c059,0.0,0.0,0.0,train,0.0,0.0,0.0,0
5411,81313,  i m not sure the etymology of the word has much to do with it  the idea of religious police is pretty common on one level or another in almost all islamic countries  it takes various forms depending on what the government decides to do  naturally  the more religious theocratic the government  the more likely it ll be a full branch of the police or even its own group  take its incarnation in saudi arabia and compare it to the village enforcement groups found in northern pakistani villages  for instance  or the versions in egypt and yemen  which have  at least at this point  more to do about making sure that the only version of islam practiced is the state sponsored one  overall  the fact remains that many islamic nations have religious police of some form or another  and leaving out the fact that it is not an institution unique to saudi arabia is inaccurate  as is claiming that it only exists in saudi arabia and iran ,d97e8e2bcee0db5a,0.0,0.0,0.0,train,0.0,0.0,0.0,0
71912,157897,create an account ,e57dc7c26b5ddd90,0.0,0.0,0.0,train,0.0,0.0,0.0,0
139507,110644,the same group of scum bag tandem editors that have controlled and now want to misrepresent any and all articles connected with technocracy issues even to the point of trying to delete the article now  http en wikipedia org wiki user talk johnfos the signpost october http en wikipedia org wiki user talk epipelagic http en wikipedia org wiki user talk beagel http en wikipedia org wiki user talk lawrencekhoo  mostly they collude to give bad information  tab the same group of tandem editors from several years ago still try and control this article  they want to eliminate an article about one of the major social movements the group that started it wikipedia is known for special interest control and buddy editing  its a pity and the reason a serious article on an important american group is being tried to be done away with by tandem editors that obviously object for some reason to the content  the past clearly shows the same team of tandem editors here  beagle and johnphos are tandem editors as is lawrencekhoo and epipelagic  one of the most significant groups in american history and they want to get rid of the article  its pathetic and shows the weakness of en  wikipedia  lawrencekhoo is a mainstream economist who ax grinds economic articles google his name for his economic  beliefs  gino,4fe4b4b8c951cdb6,0.0,0.0,0.0,train,0.0,0.0,0.0,0
154987,123815,yes that was indeed me  i have signed it now ,964a27770dbbed46,0.0,0.0,0.0,train,0.0,0.0,0.0,0
73504,36042,did anybody call for a webslinger ,60513a0e9c9714d8,0.0,0.0,0.0,train,0.0,0.0,0.0,0
101253,106414,is there someone who can tell me how to download maupiti island  the full game im so tired of looking for it please send me mail at ophelie chiaraditofifi hotmail fr  thank u in advance and have a nice day  ,394f07c52fc2e030,0.0,0.0,0.0,train,0.0,0.0,0.0,0
82726,86772,hello  did you not read the above or the article  it doesn t show up in unicode  and it s not a separate character  it s just the zero ,e81f1374b6838771,0.0,0.0,0.0,train,0.0,0.0,0.0,0
151938,30455,wikipedia articles for deletion robert stanco hi there  it seems you would like this deletion discussion blanked  we have a procedure for this  wikipedia deletion policy courtesy blanking  as old deletion debates often get highly ranked by google and can be embarrassing to those concerned  so i have blanked the page for you  cheers ,50d1d9499469716d,0.0,0.0,0.0,train,0.0,0.0,0.0,0
12320,42317,  trans lation  i  personally  would dispute that  sex ity is even a continuum  i would agree that hetero sex ity  definded as procreation  has been the norm  defined as common and or typical  throughout history  even normative  defined as prescriptive  since you also include marriage  i would need to be convinced and thus currently disagree on that point also  you of course will remember the second part from our previous disagreements and discussions  however  we need to find sources before we make such assertions in articles  and i will oppose their addition until cited  however  as it is common knowledge wikipedia npov tutorial neutral language i would support the addition of  hetero sex ity  definded as procreation  has been the norm  defined as common and or typical  throughout history aug utc  ,70ec8667aa3e761a,0.0,0.0,0.0,train,0.0,0.0,0.0,0
143923,34127,tried to add queensland party website queenslandparty org au  added party website http w queenslandparty org au but some mindless autobot deleted it  these webcrawlers are useless  they just waste precious time  i am not going to fix it again ,5b0c05bf14113215,0.0,0.0,0.0,train,0.0,0.0,0.0,0
60466,14195,agree  let s keep this article since it uses the common name general motors  lets merge the general motors llc article into this article  they contain the same information  the new general motors llc articile is not needed  there is also the history of general motors and the general motors chapter reorganization article this article is not needed ,2577301f6ef10aa0,0.0,0.0,0.0,train,0.0,0.0,0.0,0
126720,40414,rude deletion of a life saving article  you  sir  are the ruiner of a good time  i tried to make a solid  well written and informative page about a good friend of mine  i wrote it to show him the finer points of his life and how full of worth he is  he was contemplating suicide  well  when it was quickly deleted  it was the last push of rejection he needed  thanks guy  i have no page  and no best friend  i appreciate you ruining my life  sincerely  lonely murachel  ,6bd74623e85a8295,0.0,0.0,0.0,train,0.0,0.0,0.0,0
66082,68690,barnstar thank you very much for the barnstar  it is sincerely appreciated ,b7c04e4c25c224ad,0.0,0.0,0.0,train,0.0,0.0,0.0,0
159429,154762,yup  all seems sorted  as an added bonus  this impersonators tagging cause me to add a few refs to the article on the town of tampaksiring where the senang hati foundation is located  i had forgotten all about president soekarno s tampaksiring presidential palace and so i added a bit about it  an additional bit that i can t add lacking a source besides locals who told me about it is that bung karno built the palace overlooking a water temple where young balinese women bathed for the view  soekarno had quite the reputation for his conquests ,b2f9d76447217e87,0.0,0.0,0.0,train,0.0,0.0,0.0,0
15649,2738, after studying the phenomenon of electrolysis in the anglo irish physicist g  johnstone stoney suggested that there existed a single definite quantity of electricity  he was able to estimate the value of the charge e of a monovalent ion by means of faraday s laws of electrolysis this means that chemistry is part of the definitio if the electron  the value of charge  was equated to faradays laws of electrolysis  there should be an section in the electron article on chemistry and if your going to mention obscure virtual electrons why not mention chrystal fields  because that is fundamental to chemistry if your going to mention quantum physics  why cant you mention quantum chemsitry  because i think chemistry is just as important to physics if not more important and i think there should be a section on electrolysis  ,075aa080f410a458,0.0,0.0,0.0,train,0.0,0.0,0.0,0
17121,89727, aquemini  dude  you appeared at the right time  i was about to ask you if you could help me with writing credits on the track listing section  i also collected some sources in i know it s not much  but you might find them helpful  by the way  congratulations on getting some outkast albums to ga status  cheers  ,f00a2191c5ed25a4,0.0,0.0,0.0,train,0.0,0.0,0.0,0
116838,120230,ooh  good point  unless he had it on a timer  what s up  doc  carrots ,830b3e9b9c440b45,0.0,0.0,0.0,train,0.0,0.0,0.0,0
50542,71338, there is a balance issue here  the black buck raids section is peppered with wikilinks and unless the reader suffers from a very bad memory  two of the wikilinks are superfluous  i m convinced that strategic wikilinks are in order  combined with argentine replacing aaf when possible  regards  ,bef6a9b07f0c797f,0.0,0.0,0.0,train,0.0,0.0,0.0,0
95802,76871,i think that last sentence is key  yeah  i m not claiming it s as popular as doctor who or x files at its height  but a significant number searching here are looking for the tv show ,cddab92f6186051f,0.0,0.0,0.0,train,0.0,0.0,0.0,0
125113,52137,relations to kathy beale i would like to begin by apologising if i have upset and annoyed people  that has never been my intention  my only intention is to contribute towards wikipedia and improve articles involving subjects which i am particularly interested in  however  just because i have been  block  for my actions  that will not stop me from standing up for what i believe is completely right and trying to forge a consensus on facts which i believe certain editors are deliberately ignoring  i will start with kathy beale and why she should be included  those of you who have been watching eastenders for a very long time will recall  that kathy had a major involvement in the ian s custody case  i will use a few sources  http w youtube com watch v hyit xvhnd  http w youtube com watch v z fs vfluey playnext list  pl bitch f feature  results video http w youtube com watch v  ar iqedmwm these links is kathy s direct involvement in trying to rescue the beale kids from cindy beale  http w youtube com watch v  cvgcs c vw this link shows that kathy was involved in the storylines regarding lucy and mel owen  often having to look after the kids when ian was very depressed a very important storyline  http w youtube com watch v tsixlvydat  http w youtube com watch v hx tcftwp q http w youtube com watch v  kyf xojl http w youtube com watch v wp ny upexc these show kathy s strong involvement with all her grandchildren lucy  peter and steven  she even had to go to court for them  all of that is aside from the babysitting  family meals  christmases and her death which had an effect  i will make my edit  and i hope afer watching all these clips  people will come to realise what i mean and what we can come to an agreement  i d go as far as to argue that kathy is more involved to lucy s storylines  than bev williams in fact that is a fact  so let us all take stock ,8b7b4822ab7f0010,0.0,0.0,0.0,train,0.0,0.0,0.0,0
68749,108399,can  chomsky agrees with the official u s  military definition of terrorism  see his talk at mit after september th you are not a lonely  but i would suggest you read his own work before forming an opinion dec utc ,437d4d1529306240,0.0,0.0,0.0,train,0.0,0.0,0.0,0
54297,56957, welcome hello  satyam majhi  and welcome to wikipedia  thank you for your contributions  i hope you like the place and decide to stay  here are some pages that you might find helpful  the five pillars of wikipedia tutorial how to edit a page and how to develop articles how to create your first article  using the article wizard if you wish  manual of style i hope you enjoy editing here and being a wikipedian  please sign your messages on discussion pages using four tildes this will automatically insert your username and the date  if you need help  check out wikipedia questions  ask me on my talk page  or ask your question on this page and then place help me before the question  again  welcome  talk email ,983ca3529644fa8d,0.0,0.0,0.0,train,0.0,0.0,0.0,0
66981,106281,birthday her birthday is listed as december in one part of the article and december in another  some help here ,38aa76c2d4b40bf4,0.0,0.0,0.0,train,0.0,0.0,0.0,0
21011,85633, dan  sorry i ve been away from the computer today having just seen the oppose all i can say is thank goodness we had the peer review one challenge when an article has multiple authors editors is that inconsistencies in the format of citations and references is gonna happen i ll try to help on monday  sunday will be bad for me too  if certain things still need to be addressed  ,e50937b40e285e48,0.0,0.0,0.0,train,0.0,0.0,0.0,0
8404,52969,  note to reviewing administrator  these are the edits that resulted in the above block and talk  ,8d93ca7ebd8fb45c,0.0,0.0,0.0,train,0.0,0.0,0.0,0
104751,129977,just wondering about the orm s who broke away in or about ad does anybody know what became of them tildes,b74f4fbb527834b7,0.0,0.0,0.0,train,0.0,0.0,0.0,0
48738,139295, thankyou  thank you for helping me become accustomed to wikipedia  we can make a great team in the future i m sure  ,e97df4832738e937,0.0,0.0,0.0,train,0.0,0.0,0.0,0
14225,64913,  you may think as you want with your block log  anyway look here  http en wikipedia org wiki wikipedia requests for adminship khoikhoi  lol oppose questionable block history  plus i ve previously encountered this user revert warring at germanic peoples  so until i can be otherwise inclined to change my mind  oppose  wp ea e t c  at utc do you have some evidence  ie  can you show me the links to these edit wars please  chat oppose edit wars  oppose he has been in edit wars since he came here was banned several times and always tries to push his pov in articles also always disturbs the turkish users  oppose is right  he always has problems with turkish editors  oppose so far from the administration oppose edit wars and pov pushing on articles concerning macedonian issues  oppose as realek  oppose some sort of edit warring occurred less than two weeks ago not comfortable with promotion yet  more learning time is always good  oppose this user pov pushes  greek pov  the articles related to macedonia  oppose pov push in articles regarding macedonia march utc  oppose mainly for edit warring and pov push  weak oppose i am hesitant about adminship for anyone who has an easily defineable pov bias  especially a nationalistic one  strongly oppose  unfortunately this user only keeps pushing his pov  i have provided some links below  he facttionalize the discussions talk oppose track record is in poor shape reply oppose this user always has problems with turkish editors  oppose ths user doesn t know the difference between a greek pov and the truth  macedonia oppose  i agree that he keeps his cool  but revert wars seem to attract him  or he attracts them i saw him on persian people doing the same  i m not sure if a person who so quickly takes sides in different disputes would make a good admin  talk  oppose  does a lot of good work  but edit warring far too recently  and may be a pov purveyor  also  i am concerned that some of his email correspondences with other editors  mentioned on his talk page  may concern wikipedia article discussions  which would be highly innapropriate  either way  not ready for the responsibility just yet imho  oppose i searched this users edits about turkey related pages  which are a lot and i think he is not neutral at all  the most disturbing thing is that this user seems to be too certain for many subjects which really really contain many uncertainties  i am from turkey and i am not so certain and strict about many turkey related problems which i know and search about for years  i know they are very complicated  i know that many things the turkish goverment and people assert are not true  and many of the opposers are not also  so the only thing this behaviour tells me that whether this user has a narrow view over these subjects or is not trying to be neutral at all ,adb4e26b6406f68a,0.0,0.0,0.0,train,0.0,0.0,0.0,0
78278,142288,first the bad news  insisting gets you nowhere around here  and only alienates people  now the good news  your material on bjorn lomberg has been discussed in top drawer reliable sources such as the times  when and if your material on ait is similarly discussed  it can be considered for inclusion here  but until then  we have to follow wp sps ,f90f7a366de5aa06,0.0,0.0,0.0,train,0.0,0.0,0.0,0
144913,77658,unfortunately  as mentioned  the sides aren t working to a consensus  whenever a valid point is raised  the opposing side vetos it  attacks it with wikilawyering  and sometimes deletes it unitlaterally ,d007055ff869ec56,0.0,0.0,0.0,train,0.0,0.0,0.0,0
101601,151076,it doesn t end anything  that could be completely photoshopped page goes by proof and consensus consensus has been it stays sans crane you are the only one still insisting it be moved even the move page has it noted as contested ,76f5e640ace0c3e5,0.0,0.0,0.0,train,0.0,0.0,0.0,0
